{
  "$schema": "https://papersmith.ai/schemas/papersmith-manifest-v1.1.schema.json",
  "schema_version": "1.1",
  "source_pdf": "/Users/diego/Desktop/Proyectos/papersmith-ai/guidance/paper-guide/source/Li_2026_Prog._Biomed._Eng._8_022013.pdf",
  "source_sha256": "0615fb1b937eddef5eb1608455b7373ec1461c3d855bb23b94fd18ada9c0c16c",
  "processed_at": "2026-07-30T18:07:18.782249+00:00",
  "renderer": "PyMuPDF",
  "render_dpi": 200,
  "page_count": 20,
  "pages": [
    {
      "page": 1,
      "image": "Li_2026_Prog._Biomed._Eng._8_022013-assets/page-001.png",
      "raw_text": "Progress in Biomedical\nEngineering\n     \nTOPICAL REVIEW • OPEN ACCESS\nCross-subject generalization for EEG decoding: a\nsurvey of deep learning methods\nTo cite this article: Taida Li et al 2026 Prog. Biomed. Eng. 8 022013\n \nView the article online for updates and enhancements.\nYou may also like\nLatent alignment in deep learning models\nfor EEG decoding\nStylianos Bakas, Siegfried Ludwig,\nDimitrios A Adamos et al.\n-\nA class alignment network based on self-\nattention for cross-subject EEG\nclassification\nSufan Ma, Dongxiao Zhang, Jiayi Wang et\nal.\n-\nDual-channel TRCA-net based on cross-\nsubject positive transfer for SSVEP-BCI\nHui Xiong, Shuaiqi Chang and Jinzhen Liu\n-\nThis content was downloaded from IP address 152.201.58.34 on 16/07/2026 at 06:12\n",
      "text_characters": 752,
      "confidence": 0.75,
      "confidence_status": "review_required",
      "confidence_notes": "Embedded images require visual review; captions remain page-level text evidence only.",
      "textual_figure_captions": [],
      "equation_ids": [],
      "figure_ids": [
        "page-001-image-001",
        "page-001-image-002"
      ]
    },
    {
      "page": 2,
      "image": "Li_2026_Prog._Biomed._Eng._8_022013-assets/page-002.png",
      "raw_text": "Prog. Biomed. Eng. 8 (2026) 022013\nhttps://doi.org/10.1088/2516-1091/ae65f0\nProgress in Biomedical Engineering\nOPEN ACCESS\nRECEIVED\n16 February 2026\nREVISED\n21 April 2026\nACCEPTED FOR PUBLICATION\n28 April 2026\nPUBLISHED\n12 May 2026\nOriginal content from\nthis work may be used\nunder the terms of the\nCreative Commons\nAttribution 4.0 licence.\nAny further distribution\nof this work must\nmaintain attribution to\nthe author(s) and the title\nof the work, journal\ncitation and DOI.\nTOPICAL REVIEW\nCross-subject generalization for EEG decoding: a survey of deep\nlearning methods\nTaida Li1, Yujun Yan2, Fei Dou3, Wenzhan Song4and Xiang Zhang1,∗\n1 Department of Computer Science, University of North Carolina at Charlotte, Charlotte, NC, United States of America\n2 Department of Computer Science, Dartmouth College, Hanover, NH, United States of America\n3 School of Computing, University of Georgia, Athens, GA, United States of America\n4 School of Electrical and Computer Engineering, University of Georgia, Athens, GA, United States of America\n∗Author to whom any correspondence should be addressed.\nE-mail: xiang.zhang@charlotte.edu\nKeywords: deep learning, EEG, cross-subject, generalization\nAbstract\nDeep learning for cross-subject electroencephalography (EEG) decoding is hindered by high\ninter-subject variability, which introduces a severe domain shift between training and unseen test\nsubjects. This survey presents a comprehensive review of deep learning methodologies specific-\nally engineered to address this cross-subject generalization challenge. To ground this analysis, we\nformalize the cross-subject setting as a multi-source domain problem and delineate the rigorous,\nsubject-independent evaluation protocols required for valid assessment. Central to this survey is a\nsystematic taxonomy of the current literature into discrete methodological families, including fea-\nture alignment, adversarial learning, feature disentanglement, and contrastive learning. We con-\nclude by examining three critical elements for advancing robust, real-world decoding: the theor-\netical limitations of current methodologies, the structural value of subject identity, and the emer-\ngence of EEG foundation models.\n1. Introduction\nThe application of deep learning to electroencephalography (EEG) signal decoding has marked a signi-\nficant paradigm shift in computational neuroscience and brain-computer interfaces (BCIs) [1]. Due to\ntheir capacity for automatic feature extraction from high-dimensional time-series data, deep neural net-\nworks have emerged as a promising paradigm complementing traditional machine learning pipelines that\nrely on hand-crafted features. This has led to notable advancements in a variety of applications, includ-\ning clinical diagnostics for conditions like epilepsy [2, 3], analysis of cognitive and affective states such\nas emotion recognition [4, 5], and the decoding of motor imagery [6]. A schematic of this end-to-end\nprocess is illustrated in figure 1, demonstrating how raw EEG recordings are mapped through neural\nnetwork feature extractors to generate these diverse downstream predictions.\nDespite these successes, a fundamental obstacle hinders the translation of these models from laborat-\nory settings to practical, real-world applications: the profound inter-subject variability of EEG signals [7,\n8]. Individual variations in physiology, anatomy, and cognition manifest as distinct neural signatures,\nleading to significant inter-subject variability [8]. This high variability has two critical consequences for\ndeep learning models. First, it creates a domain shift, where the data distribution of a new, unseen sub-\nject is significantly different from that of the subjects in the training set. Second, a high-capacity neural\nnetwork is prone to overfitting to the salient, subject-specific features rather than learning the more\nsubtle, task-relevant neural patterns. The combination of this domain shift and the model’s tendency\nto exploit subject-specific confounds leads to a catastrophic drop in performance when generalizing to a\nnew user, which is the central cross-subject challenge. This situation presents a unique, two-sided prob-\nlem. The challenge is rooted in the powerful, subject-specific biomarkers inherent in the EEG signals, to\nwhich models are prone to overfit. The opportunity, however, arises because this inter-subject variability\nis not random noise, but rather a structured phenomenon tied to the individual. Physiological datasets\n© 2026 The Author(s). Published by IOP Publishing Ltd\n",
      "text_characters": 4553,
      "confidence": 0.95,
      "confidence_status": "acceptable",
      "confidence_notes": "Machine-readable text was preserved with page-image provenance.",
      "textual_figure_captions": [],
      "equation_ids": [],
      "figure_ids": []
    },
    {
      "page": 3,
      "image": "Li_2026_Prog._Biomed._Eng._8_022013-assets/page-003.png",